{
  "$schema": "http://json-schema.org/draft-07/schema#",
  "$id": "https://example.com/schemas/codex-plugin.schema.json",
  "title": "Codex plugin manifest (.codex-plugin/plugin.json)",
  "description": "Synthesized from the upstream Codex plugin manifest specification (developers.openai.com/codex/plugins) and cross-checked against the RawPluginManifest Rust type at codex-rs/core-plugins/src/manifest.rs. The manifest spec is broader than what the local Rust parser deserializes — fields like author/homepage/repository/license/keywords are valid published-manifest fields consumed by the marketplace UI and publishing tools, not by the CLI's runtime parser.",
  "type": "object",
  "required": ["name"],
  "additionalProperties": true,
  "properties": {
    "name": {
      "type": "string",
      "description": "Plugin identifier.",
      "minLength": 1
    },
    "version": {
      "type": "string",
      "description": "Semver."
    },
    "description": {
      "type": "string",
      "description": "Short description shown in marketplace UI."
    },
    "author": {
      "description": "Plugin creator or maintainer information.",
      "type": "object",
      "required": ["name"],
      "properties": {
        "name":  { "type": "string", "minLength": 1 },
        "email": { "type": "string", "format": "email" },
        "url":   { "type": "string", "format": "uri" }
      },
      "additionalProperties": true
    },
    "homepage":   { "type": "string", "format": "uri" },
    "repository": { "type": "string", "format": "uri", "description": "Source code repository URL." },
    "license":    { "type": "string", "description": "SPDX license identifier (e.g., MIT, Apache-2.0)." },
    "keywords": {
      "type": "array",
      "description": "Tags for plugin discovery.",
      "items": { "type": "string" }
    },
    "skills": {
      "type": "string",
      "description": "Relative path (./...) to a skills folder.",
      "pattern": "^\\./"
    },
    "mcpServers": {
      "type": "string",
      "description": "Relative path (./...) to an mcpServers configuration file (typically ./.mcp.json).",
      "pattern": "^\\./"
    },
    "apps": {
      "type": "string",
      "description": "Relative path (./...) to an apps manifest (typically ./.app.json).",
      "pattern": "^\\./"
    },
    "interface": {
      "type": "object",
      "description": "Install-surface metadata controlling how the plugin is presented.",
      "additionalProperties": true,
      "properties": {
        "displayName":         { "type": "string", "description": "Plugin title shown on install surfaces." },
        "shortDescription":    { "type": "string" },
        "longDescription":     { "type": "string" },
        "developerName":       { "type": "string" },
        "category":            { "type": "string" },
        "capabilities":        { "type": "array", "items": { "type": "string" } },
        "websiteURL":          { "type": "string", "format": "uri" },
        "websiteUrl":          { "type": "string", "format": "uri", "description": "Lowercase-Url alias accepted by the parser." },
        "privacyPolicyURL":    { "type": "string", "format": "uri" },
        "privacyPolicyUrl":    { "type": "string", "format": "uri" },
        "termsOfServiceURL":   { "type": "string", "format": "uri" },
        "termsOfServiceUrl":   { "type": "string", "format": "uri" },
        "defaultPrompt": {
          "description": "Starter prompts shown to users. Up to 3 items, each ≤128 chars (per MAX_DEFAULT_PROMPT_COUNT/MAX_DEFAULT_PROMPT_LEN in the upstream parser).",
          "oneOf": [
            { "type": "string", "maxLength": 128 },
            {
              "type": "array",
              "items": { "type": "string", "maxLength": 128 },
              "maxItems": 3
            }
          ]
        },
        "brandColor":   { "type": "string", "description": "Hex color (e.g., \"#10A37F\")." },
        "composerIcon": { "type": "string", "description": "Relative path to a composer icon image (typically under ./assets/)." },
        "logo":         { "type": "string", "description": "Relative path to a logo image (typically under ./assets/)." },
        "screenshots":  {
          "type": "array",
          "description": "Relative paths to screenshot images (typically under ./assets/).",
          "items": { "type": "string" }
        }
      }
    }
  }
}
