{
  "$schema": "https://json.schemastore.org/claude-code-plugin-manifest.json",
  "name": "arcane-mcp",
  "description": "Manage Docker containers, images, volumes, networks, and stacks via the Arcane API.",
  "author": {
    "name": "Jacob Magar",
    "email": "jmagar@users.noreply.github.com"
  },
  "repository": "https://github.com/jmagar/arcane-mcp",
  "homepage": "https://github.com/jmagar/arcane-mcp",
  "license": "MIT",
  "keywords": [
    "arcane",
    "docker",
    "homelab",
    "mcp",
    "containers"
  ]
}
