{
  "$schema": "https://json.schemastore.org/claude-code-plugin-manifest.json",
  "name": "github",
  "description": "GitHub workflow skills for CI debugging and pull request review thread resolution.",
  "author": {
    "name": "Jacob Magar",
    "email": "jmagar@users.noreply.github.com"
  },
  "repository": "https://github.com/jmagar/claude-homelab",
  "homepage": "https://github.com/jmagar/claude-homelab",
  "license": "MIT",
  "keywords": [
    "github",
    "ci",
    "pull-requests",
    "reviews",
    "automation"
  ]
}
