{
  "$schema": "https://json.schemastore.org/claude-code-plugin-manifest.json",
  "name": "birdclaw",
  "description": "Local-first X/Twitter archive CLI by Peter Steinberger. Syncs likes, bookmarks, DMs, and mentions to a local SQLite database. Transport-agnostic: xurl (X API v2, paid tier) or bird (external cookie-backed CLI). No MCP server — pure CLI.",
  "author": {
    "name": "Jacob Magar",
    "email": "jmagar@users.noreply.github.com"
  },
  "repository": "https://github.com/jmagar/claude-homelab",
  "homepage": "https://github.com/steipete/birdclaw",
  "license": "MIT",
  "keywords": [
    "birdclaw",
    "twitter",
    "x",
    "archive",
    "local-first",
    "sqlite",
    "bookmarks",
    "likes",
    "dms",
    "cli"
  ]
}
