{
  "$schema": "https://json.schemastore.org/claude-code-plugin-manifest.json",
  "name": "uptime_kuma",
  "description": "Skill for operating uptime kuma via the lab MCP server / CLI.",
  "author": {
    "name": "Jacob Magar",
    "email": "jmagar@users.noreply.github.com"
  },
  "repository": "https://github.com/jmagar/lab",
  "homepage": "https://github.com/jmagar/lab",
  "license": "MIT",
  "keywords": [
    "uptime-kuma",
    "monitoring",
    "uptime",
    "status",
    "homelab"
  ]
}