{
  "$schema": "https://json.schemastore.org/claude-code-plugin-manifest.json",
  "name": "qmd",
  "description": "Local-first semantic markdown search via qmd. Combines BM25 keyword search, vector similarity search, and LLM re-ranking—all running on-device with no cloud calls or API keys required.",
  "author": {
    "name": "Jacob Magar",
    "email": "jmagar@users.noreply.github.com"
  },
  "repository": "https://github.com/jmagar/claude-homelab",
  "homepage": "https://github.com/tobi/qmd",
  "license": "MIT",
  "keywords": [
    "qmd",
    "semantic-search",
    "markdown",
    "bm25",
    "vector-search",
    "local-first",
    "mcp",
    "rag",
    "knowledge-base"
  ]
}
