{
  "$schema": "https://json.schemastore.org/claude-code-plugin-manifest.json",
  "name": "glances",
  "description": "Skill for operating glances via the lab MCP server / CLI.",
  "author": {
    "name": "Jacob Magar",
    "email": "jmagar@users.noreply.github.com"
  },
  "repository": "https://github.com/jmagar/lab",
  "homepage": "https://github.com/jmagar/lab",
  "license": "MIT",
  "keywords": [
    "glances",
    "monitoring",
    "system",
    "metrics",
    "homelab"
  ]
}