{
  "$schema": "https://json.schemastore.org/claude-code-plugin-manifest.json",
  "name": "neo4j",
  "description": "Skill for operating neo4j via the lab MCP server / CLI.",
  "author": {
    "name": "Jacob Magar",
    "email": "jmagar@users.noreply.github.com"
  },
  "repository": "https://github.com/jmagar/lab",
  "homepage": "https://github.com/jmagar/lab",
  "license": "MIT",
  "keywords": [
    "neo4j",
    "graph",
    "database",
    "cypher",
    "homelab"
  ]
}