{
  "$schema": "https://json.schemastore.org/claude-code-plugin-manifest.json",
  "name": "syslog-mcp",
  "description": "Syslog management via MCP",
  "author": {
    "name": "jmagar"
  },
  "repository": "https://github.com/jmagar/syslog-mcp",
  "license": "MIT",
  "keywords": [
    "syslog",
    "mcp",
    "logging",
    "homelab"
  ]
}
