{
  "$schema": "https://json.schemastore.org/claude-code-plugin-manifest.json",
  "name": "lab",
  "description": "Skills and MCP configuration for the Lab homelab control plane.",
  "author": {
    "name": "Jacob Magar",
    "email": "jmagar@users.noreply.github.com"
  },
  "repository": "https://github.com/jmagar/claude-homelab",
  "homepage": "https://github.com/jmagar/claude-homelab",
  "license": "MIT",
  "keywords": [
    "lab",
    "homelab",
    "mcp",
    "gateway",
    "marketplace"
  ]
}
