{
  "$schema": "https://json.schemastore.org/claude-code-plugin-manifest.json",
  "name": "discrawl",
  "description": "Discord archiver plugin wrapping Peter Steinberger's discrawl CLI. Bot-token-based (TOS-compliant), Go binary. Archives guild messages and DMs to local SQLite with full-text and semantic search.",
  "author": {
    "name": "Jacob Magar",
    "email": "jmagar@users.noreply.github.com"
  },
  "repository": "https://github.com/jmagar/claude-homelab",
  "homepage": "https://github.com/steipete/discrawl",
  "license": "MIT",
  "keywords": [
    "discrawl",
    "discord",
    "archiver",
    "sqlite",
    "fts",
    "semantic-search",
    "local-first",
    "bot-token"
  ]
}
