{
  "$schema": "https://json.schemastore.org/claude-code-plugin-manifest.json",
  "name": "jellyfin",
  "description": "Jellyfin media server workflows for homelab operations.",
  "author": {
    "name": "Jacob Magar",
    "email": "jmagar@users.noreply.github.com"
  },
  "repository": "https://github.com/jmagar/claude-homelab",
  "homepage": "https://github.com/jmagar/claude-homelab",
  "license": "MIT",
  "keywords": [
    "jellyfin",
    "media",
    "streaming",
    "homelab"
  ]
}
