{
  "$schema": "https://json.schemastore.org/claude-code-plugin-manifest.json",
  "name": "axon",
  "description": "Skills and MCP configuration for the Axon crawl, ingest, embed, query, and RAG engine.",
  "author": {
    "name": "Jacob Magar",
    "email": "jmagar@users.noreply.github.com"
  },
  "repository": "https://github.com/jmagar/claude-homelab",
  "homepage": "https://github.com/jmagar/claude-homelab",
  "license": "MIT",
  "keywords": [
    "axon",
    "rag",
    "crawl",
    "mcp",
    "qdrant",
    "tei"
  ]
}
