{
  "$schema": "https://json.schemastore.org/claude-code-plugin-manifest.json",
  "name": "summarize",
  "description": "Multi-source LLM summarizer — URLs, PDFs, files, YouTube, podcasts, RSS — via Peter Steinberger's summarize CLI. BYO API key.",
  "author": {
    "name": "Jacob Magar",
    "email": "jmagar@users.noreply.github.com"
  },
  "repository": "https://github.com/jmagar/claude-homelab",
  "homepage": "https://github.com/steipete/summarize",
  "license": "MIT",
  "keywords": [
    "summarize",
    "llm",
    "summarization",
    "youtube",
    "podcast",
    "pdf"
  ]
}
