{
  "$schema": "https://json.schemastore.org/claude-code-plugin-manifest.json",
  "name": "claude-in-mobile",
  "description": "Claude Mobile MCP workflows for Android, iOS Simulator, macOS desktop apps, Aurora OS, browser, and app-store automation.",
  "author": {
    "name": "Jacob Magar",
    "email": "jmagar@users.noreply.github.com"
  },
  "repository": "https://github.com/jmagar/claude-homelab",
  "homepage": "https://github.com/jmagar/claude-homelab",
  "license": "MIT",
  "keywords": [
    "claude-in-mobile",
    "mobile",
    "android",
    "ios",
    "desktop",
    "browser",
    "mcp",
    "automation"
  ]
}
