{
  "$schema": "https://json.schemastore.org/claude-code-plugin-manifest.json",
  "name": "codex",
  "description": "Codex plugin, skill, agent, and workflow reference skills.",
  "author": {
    "name": "Jacob Magar",
    "email": "jmagar@users.noreply.github.com"
  },
  "repository": "https://github.com/jmagar/claude-homelab",
  "homepage": "https://github.com/jmagar/claude-homelab",
  "license": "MIT",
  "keywords": [
    "codex",
    "plugins",
    "skills",
    "agents"
  ]
}
