{
  "$schema": "https://json.schemastore.org/claude-code-plugin-manifest.json",
  "name": "bytestash",
  "description": "Skills for operating a ByteStash snippet manager.",
  "author": {
    "name": "Jacob Magar",
    "email": "jmagar@users.noreply.github.com"
  },
  "repository": "https://github.com/jmagar/claude-homelab",
  "homepage": "https://github.com/jmagar/claude-homelab",
  "license": "MIT",
  "keywords": [
    "bytestash",
    "snippets",
    "notes",
    "homelab"
  ]
}
